{
  "$id": "urn:ratatoskr:contracts:commands:v1:SocialCaptureRequested",
  "$schema": "https://json-schema.org/draft/2020-12/schema",
  "title": "SocialCaptureRequested",
  "description": "Payload for a Platform-to-social-owner explicit public-permalink capture.",
  "type": "object",
  "properties": {
    "acquisition": {
      "description": "This lane is an explicit browser-extension capture.",
      "$ref": "#/$defs/AcquisitionMethod"
    },
    "captured_at": {
      "description": "Instant the browser captured the permalink.",
      "$ref": "#/$defs/WireTimestamp"
    },
    "idempotency_key": {
      "description": "Stable digest of the user intent for domain-level idempotency.",
      "$ref": "#/$defs/ContentDigest"
    },
    "operation_id": {
      "description": "Long-running operation Platform created for this user action.",
      "$ref": "#/$defs/OperationId"
    },
    "original_permalink": {
      "description": "The original public HTTPS permalink the user captured.",
      "$ref": "#/$defs/PostPermalink"
    },
    "provider": {
      "description": "The service that owns acquisition for this social provider.",
      "$ref": "#/$defs/SocialCaptureProvider"
    },
    "saved_authority": {
      "description": "This lane never claims native provider Saved/bookmark authority.",
      "$ref": "#/$defs/SavedAuthority"
    }
  },
  "additionalProperties": true,
  "required": [
    "acquisition",
    "captured_at",
    "idempotency_key",
    "operation_id",
    "original_permalink",
    "provider",
    "saved_authority"
  ],
  "x-ratatoskr-provenance": {
    "canonical_source": "ratatoskr_social_contracts::SocialCaptureRequested",
    "contract_id": "social.capture_requested",
    "contract_major_version": 1,
    "generated": "DO NOT EDIT — generated by contractsc from the canonical Rust source. Change the Rust type and run `cargo contracts generate`.",
    "generator": "contractsc",
    "generator_version": "0.1.0",
    "schemars_version": "1.2.2",
    "source_digest": "sha256:989c70e0062f3bbda11b22ce184aa3bf5e3ea407000e2ca8c750e4e95907ea7f",
    "validation_note": "This schema is a LOWER BOUND on validity. Cross-field invariants and canonical-form rules are enforced by the canonical Rust type; see fixtures/invalid-expectations.toml for which layer rejects what."
  },
  "x-ratatoskr-unknown-policy": "preserve",
  "$defs": {
    "AcquisitionMethod": {
      "description": "How the source entered the user's library.\n\n**Closed on purpose.** An unknown value is rejected at parse rather than guessed at: the\nmethod determines retention, re-acquisition and provenance handling, and silently filing an\nunrecognized method under a default is how provenance rots. Adding a variant is an additive\nwire change that consumers adopt by upgrading.",
      "oneOf": [
        {
          "description": "Read from the platform's supported, authenticated API.",
          "type": "string",
          "const": "official_api"
        },
        {
          "description": "The user pushed it in through an OS or browser share target.",
          "type": "string",
          "const": "share_extension"
        },
        {
          "description": "The user pushed it in through a browser extension.",
          "type": "string",
          "const": "browser_extension"
        },
        {
          "description": "Resolved from the platform's public, unauthenticated metadata surface (oEmbed-style).",
          "type": "string",
          "const": "public_resolution"
        },
        {
          "description": "Parsed out of a provider data export the user supplied.",
          "type": "string",
          "const": "data_export"
        },
        {
          "description": "Carried over from the retired monolith's stored state.",
          "type": "string",
          "const": "legacy_import"
        }
      ]
    },
    "ContentDigest": {
      "description": "A content digest with an explicit algorithm.",
      "type": "object",
      "properties": {
        "algorithm": {
          "description": "Hash algorithm used to produce `hex`.",
          "$ref": "#/$defs/DigestAlgorithm"
        },
        "hex": {
          "description": "Lowercase hexadecimal digest bytes.",
          "$ref": "#/$defs/DigestHex"
        }
      },
      "additionalProperties": false,
      "required": [
        "algorithm",
        "hex"
      ]
    },
    "DigestAlgorithm": {
      "description": "Algorithm used to calculate a content digest.",
      "oneOf": [
        {
          "description": "SHA-256.",
          "type": "string",
          "const": "sha256"
        }
      ]
    },
    "DigestHex": {
      "title": "DigestHex",
      "description": "Lowercase hexadecimal bytes of a content digest.",
      "type": "string",
      "examples": [
        "0000000000000000000000000000000000000000000000000000000000000000"
      ],
      "maxLength": 64,
      "pattern": "^[0-9a-f]{64}$"
    },
    "OperationId": {
      "title": "OperationId",
      "description": "Identity of one long-running operation, stable for its whole lifecycle. Bare canonical lowercase hyphenated UUID; not namespaced.",
      "type": "string",
      "format": "uuid",
      "examples": [
        "018f0000-0000-7000-8000-000000000001"
      ],
      "pattern": "^[0-9a-f]{8}-[0-9a-f]{4}-[0-9a-f]{4}-[0-9a-f]{4}-[0-9a-f]{12}$"
    },
    "PostPermalink": {
      "title": "PostPermalink",
      "description": "The canonical HTTPS permalink of a source on its platform.\n\nA deliberate lower bound: absolute `https://`, no whitespace, no control characters.\nFull URL syntax validation belongs to the producer that minted the link; this contract\nonly guarantees the value is unambiguous to render and store. `http://` is refused —\nevery supported platform serves permalinks over TLS.",
      "type": "string",
      "examples": [
        "https://x.com/example_user/status/1234567890"
      ],
      "maxLength": 2048,
      "pattern": "^https://[!-~]{1,2000}$"
    },
    "SavedAuthority": {
      "description": "What the saved-state claim in this snapshot is worth.\n\n**Closed on purpose.** `AGENTS.md`: never model Instagram or Threads explicit capture as\nauthoritative membership in the provider's native Saved list. An unknown authority must stop\nprocessing — a consumer that guesses treats a maybe-saved source as saved.",
      "oneOf": [
        {
          "description": "The platform itself exposes this saved state (e.g. X bookmarks through the supported\nAPI). The strongest claim; folder membership may be provider-authoritative too.",
          "type": "string",
          "const": "authoritative_platform_state"
        },
        {
          "description": "A user action inside Ratatoskr captured the source; the provider's own state is unknown.",
          "type": "string",
          "const": "explicit_user_capture"
        },
        {
          "description": "A provider data export shows the item was saved at some point, without live authority.",
          "type": "string",
          "const": "export_observation"
        },
        {
          "description": "Migrated from the retired monolith; authority is as good as that record was.",
          "type": "string",
          "const": "legacy_observation"
        }
      ]
    },
    "SocialCaptureProvider": {
      "description": "The social owner to which Platform routes an explicit capture.",
      "oneOf": [
        {
          "description": "X owns the permalink.",
          "type": "string",
          "const": "x"
        },
        {
          "description": "Instagram owns the permalink.",
          "type": "string",
          "const": "instagram"
        },
        {
          "description": "Threads owns the permalink.",
          "type": "string",
          "const": "threads"
        }
      ]
    },
    "WireTimestamp": {
      "title": "WireTimestamp",
      "description": "An instant on the wire: RFC 3339 in UTC with the literal `Z` designator. Exactly one spelling is accepted per instant — an input that does not re-render to itself is rejected. The field holding it declares the clock authority.",
      "type": "string",
      "format": "date-time",
      "examples": [
        "2026-08-17T10:00:00Z"
      ],
      "pattern": "^\\d{4}-\\d{2}-\\d{2}T\\d{2}:\\d{2}:\\d{2}(\\.\\d{1,9})?Z$"
    }
  }
}
